{
  "$schema": "https://json-schema.org/draft/2020-12/schema",
  "$id": "https://autocodex.dev/contracts/autonomy-tasks.schema.json",
  "title": "autocodex autonomy tasks",
  "type": "object",
  "additionalProperties": false,
  "required": ["version", "generated_at", "source_plan", "tasks"],
  "properties": {
    "version": {
      "type": "string",
      "minLength": 1
    },
    "generated_at": {
      "type": "string",
      "format": "date-time"
    },
    "source_plan": {
      "type": "string",
      "minLength": 1
    },
    "tasks": {
      "type": "array",
      "items": {
        "$ref": "#/definitions/task"
      }
    }
  },
  "definitions": {
    "task": {
      "type": "object",
      "additionalProperties": false,
      "required": ["id", "title", "goal", "files", "acceptance_criteria"],
      "properties": {
        "id": {
          "type": "string",
          "minLength": 1
        },
        "title": {
          "type": "string",
          "minLength": 1
        },
        "goal": {
          "type": "string",
          "minLength": 1
        },
        "scope": {
          "type": "array",
          "items": {
            "type": "string"
          }
        },
        "files": {
          "type": "array",
          "items": {
            "type": "string"
          }
        },
        "dependencies": {
          "type": "array",
          "items": {
            "type": "string"
          }
        },
        "skills": {
          "type": "array",
          "items": {
            "type": "string"
          }
        },
        "acceptance_criteria": {
          "type": "array",
          "items": {
            "type": "string"
          }
        },
        "tests": {
          "type": "array",
          "items": {
            "type": "string"
          }
        },
        "docs": {
          "type": "array",
          "items": {
            "type": "string"
          }
        },
        "rollout": {
          "type": "string"
        },
        "observability": {
          "type": "string"
        },
        "status": {
          "type": "string",
          "enum": ["todo", "in_progress", "review", "done", "blocked"]
        },
        "priority": {
          "type": "integer",
          "minimum": 0
        },
        "owner": {
          "type": "string"
        },
        "notes": {
          "type": "string"
        }
      }
    }
  }
}
